<?xml version="1.0" encoding="utf-8"?>
<!DOCTYPE EWDSearch SYSTEM "../../dtd/ewdsearch.dtd">
<EWDSearch ver="2.1.2.9" pubno="EM25T2E" xml:lang="en">
  <ttl id="WR016">
    <part type="conn" code="b3">
      <name>Back Door Courtesy Light Switch Assembly</name>
    </part>
    <part type="conn" code="b1">
      <name>Back Door Lock Assembly</name>
    </part>
    <part type="conn" code="Y3">
      <name>Center Stop Light Assembly</name>
    </part>
    <part type="conn" code="V2">
      <name>Differential Lock Shift Actuator</name>
    </part>
    <part type="conn" code="U1">
      <name>Front Door Courtesy Light Switch Assembly LH</name>
    </part>
    <part type="conn" code="X2">
      <name>Fuel Pump (Sub)</name>
    </part>
    <part type="conn" code="X1">
      <name>Fuel Sender Gage Assembly (Rear)</name>
    </part>
    <part type="conn" code="W2">
      <name>Fuel Tank Solenoid Main Valve Assembly</name>
    </part>
    <part type="conn" code="W1">
      <name>Fuel Tank Solenoid Return Valve Assembly</name>
    </part>
    <part type="conn" code="b4">
      <name>License Plate Light Assembly</name>
    </part>
    <part type="conn" code="e1">
      <name>License Plate Light Assembly</name>
    </part>
    <part type="conn" code="Y5">
      <name>No. 1 Room Light Assembly</name>
    </part>
    <part type="conn" code="Y4">
      <name>No. 2 Room Light Assembly</name>
    </part>
    <part type="conn" code="Y2">
      <name>No. 3 Room Light Assembly</name>
    </part>
    <part type="conn" code="Y1">
      <name>No. 3 Room Light Assembly</name>
    </part>
    <part type="conn" code="i1">
      <name>Outer Rear View Mirror Assembly LH</name>
    </part>
    <part type="conn" code="j1">
      <name>Outer Rear View Mirror Assembly RH</name>
    </part>
    <part type="conn" code="V1">
      <name>Rear Differential Lock Position Switch</name>
    </part>
    <part type="conn" code="V3">
      <name>Rear Speed Sensor (Skid Control Sensor Wire)</name>
    </part>
    <part type="conn" code="f1">
      <name>Rear Window Defogger (Back Door Glass LH)</name>
    </part>
    <part type="conn" code="d1">
      <name>Rear Window Defogger (Back Door Glass LH)</name>
    </part>
    <part type="conn" code="c1">
      <name>Rear Window Defogger (Back Door Glass RH)</name>
    </part>
    <part type="conn" code="c2">
      <name>Rear Window Defogger (Back Door Glass RH)</name>
    </part>
    <part type="conn" code="a1">
      <name>Rear Wiper Motor Assembly</name>
    </part>
    <part type="conn" code="U5">
      <name>Tire Pressure Warning ECU and Receiver</name>
    </part>
  </ttl>
</EWDSearch>