<?xml version="1.0" encoding="utf-8"?>
<!DOCTYPE EWDSearch SYSTEM "../../dtd/ewdsearch.dtd">
<EWDSearch ver="2.1.2.9" pubno="EM25T2E" xml:lang="en">
  <ttl id="WR053">
    <part type="w2w" code="Pi1">
      <name>Front Door Wire LH and Switch Wire LH</name>
    </part>
    <part type="w2w" code="Oj2">
      <name>Front Door Wire RH and Switch Wire RH</name>
    </part>
    <part type="w2w" code="Oj1">
      <name>Front Door Wire RH and Switch Wire RH</name>
    </part>
    <part type="w2w" code="aS2">
      <name>No. 1 Back Door Wire and Floor Wire</name>
    </part>
    <part type="w2w" code="aS1">
      <name>No. 1 Back Door Wire and Floor Wire</name>
    </part>
    <part type="w2w" code="aS3">
      <name>No. 1 Back Door Wire and Floor Wire</name>
    </part>
    <part type="w2w" code="ca4">
      <name>No. 1 Rear Window Wire and No. 1 Back Door Wire</name>
    </part>
    <part type="w2w" code="ca3">
      <name>No. 1 Rear Window Wire and No. 1 Back Door Wire</name>
    </part>
    <part type="w2w" code="YS4">
      <name>No. 1 Roof Wire and Floor Wire</name>
    </part>
    <part type="w2w" code="bT3">
      <name>No. 2 Back Door Wire and No. 2 Floor Wire</name>
    </part>
    <part type="w2w" code="bT1">
      <name>No. 2 Back Door Wire and No. 2 Floor Wire</name>
    </part>
    <part type="w2w" code="bT2">
      <name>No. 2 Back Door Wire and No. 2 Floor Wire</name>
    </part>
    <part type="w2w" code="bf1">
      <name>No. 2 Back Door Wire and No. 4 Back Door Wire</name>
    </part>
    <part type="w2w" code="TS1">
      <name>No. 2 Floor Wire and Floor Wire</name>
    </part>
    <part type="w2w" code="TS2">
      <name>No. 2 Floor Wire and Floor Wire</name>
    </part>
    <part type="w2w" code="TS3">
      <name>No. 2 Floor Wire and Floor Wire</name>
    </part>
    <part type="w2w" code="TS4">
      <name>No. 2 Floor Wire and Floor Wire</name>
    </part>
    <part type="w2w" code="TV2">
      <name>No. 2 Floor Wire and Frame Wire</name>
    </part>
    <part type="w2w" code="TX1">
      <name>No. 2 Floor Wire and No. 3 Frame Wire</name>
    </part>
    <part type="w2w" code="WC2">
      <name>No. 2 Frame Wire and Engine Wire</name>
    </part>
    <part type="w2w" code="db1">
      <name>No. 2 Rear Window Wire and No. 2 Back Door Wire</name>
    </part>
    <part type="w2w" code="eb2">
      <name>No. 3 Back Door Wire and No. 2 Back Door Wire</name>
    </part>
    <part type="w2w" code="XT1">
      <name>No. 3 Frame Wire and No. 2 Floor Wire</name>
    </part>
  </ttl>
</EWDSearch>