<?xml version="1.0" encoding="utf-8"?>
<!DOCTYPE EWDSearch SYSTEM "../../dtd/ewdsearch.dtd">
<EWDSearch ver="2.1.2.9" pubno="EM25T2E" xml:lang="en">
  <ttl id="SYS048">
    <part type="conn" code="I46">
      <name>Diode (Wiper Relay)</name>
    </part>
    <part type="conn" code="A22">
      <name>No. 1 Junction Connector</name>
    </part>
    <part type="conn" code="I59">
      <name>No. 10 Junction Connector</name>
    </part>
    <part type="conn" code="I63,I65">
      <name>No. 13 Junction Connector</name>
    </part>
    <part type="conn" code="A23">
      <name>No. 2 Junction Connector</name>
    </part>
    <part type="conn" code="L33">
      <name>No. 25 Junction Connector</name>
    </part>
    <part type="conn" code="L39">
      <name>No. 31 Junction Connector</name>
    </part>
    <part type="conn" code="I57">
      <name>No. 8 Junction Connector</name>
    </part>
    <part type="conn" code="I35">
      <text>M</text>
      <name>Windshield Washer Motor and Pump Assembly</name>
    </part>
    <part type="conn" code="A12">
      <text>B +S E M +2 +1</text>
      <name>Windshield Wiper Motor Assembly</name>
    </part>
    <part type="conn" code="L22,L23">
      <text>+B +2 +1 MIST OFF HI EW WF LO</text>
      <name>Windshield Wiper Switch Assembly</name>
      <name type="inner">Off</name>
      <name type="inner">Front Washer Switch</name>
      <name type="inner">Front Wiper Switch</name>
      <name type="inner">On</name>
    </part>
    <part type="conn" code="I26">
      <name>Wiper Lock Switch (Limit Switch Assembly)</name>
    </part>
    <part type="fuse" code="FUSE20">
      <text>ECU IG</text>
    </part>
    <part type="fuse" code="FUSE29">
      <text>WIP</text>
    </part>
  </ttl>
</EWDSearch>