<?xml version="1.0" encoding="utf-8"?>
<!DOCTYPE EWDSearch SYSTEM "../../dtd/ewdsearch.dtd">
<EWDSearch ver="2.1.2.9" pubno="EM25T2E" xml:lang="en">
  <ttl id="WR010">
    <part type="conn" code="I2">
      <name>A/C Pressure Switch (Cooler Refrigerant Liquid Pipe B)</name>
    </part>
    <part type="conn" code="D8">
      <name>Battery (Main)</name>
    </part>
    <part type="conn" code="k2">
      <name>Battery (Main)</name>
    </part>
    <part type="conn" code="D9">
      <name>Battery (Main)</name>
    </part>
    <part type="conn" code="I84">
      <text>ECM</text>
    </part>
    <part type="conn" code="J2">
      <name>Fog Light Assembly LH</name>
    </part>
    <part type="conn" code="J1">
      <name>Fog Light Assembly RH</name>
    </part>
    <part type="conn" code="I52">
      <name>Front Airbag Sensor RH</name>
    </part>
    <part type="conn" code="r3">
      <name>Fuel Temperature Sensor</name>
    </part>
    <part type="conn" code="I76">
      <name>Fuse Block Assembly</name>
    </part>
    <part type="conn" code="I36">
      <name>Headlight Assembly RH</name>
    </part>
    <part type="conn" code="I91">
      <name>Headlight Assembly RH</name>
    </part>
    <part type="conn" code="I38">
      <name>Headlight Assembly RH</name>
    </part>
    <part type="conn" code="I44">
      <name>Headlight Assembly RH</name>
    </part>
    <part type="conn" code="m3">
      <name>No. 1 Magnet Switch Assembly</name>
    </part>
    <part type="conn" code="k1">
      <name>No. 1 Magnet Switch Assembly</name>
    </part>
    <part type="conn" code="m4">
      <name>No. 1 Magnet Switch Assembly</name>
    </part>
    <part type="conn" code="I25">
      <name>Side Turn Signal Light Assembly RH</name>
    </part>
    <part type="conn" code="D7">
      <name>Starter Assembly</name>
    </part>
    <part type="conn" code="D6">
      <name>Starter Assembly</name>
    </part>
    <part type="conn" code="r2">
      <name>Suction Control Valve</name>
    </part>
    <part type="conn" code="I48">
      <name>Thermistor Assembly</name>
    </part>
    <part type="conn" code="I32">
      <name>Vacuum Warning Switch Assembly</name>
    </part>
    <part type="conn" code="s1">
      <name>Winch Assembly</name>
    </part>
    <part type="conn" code="s2">
      <name>Winch Motor with Magnet Switch Assembly</name>
    </part>
    <part type="conn" code="t1">
      <name>Winch Motor with Magnet Switch Assembly</name>
    </part>
    <part type="conn" code="m2">
      <name>Winch Motor with Magnet Switch Assembly</name>
    </part>
    <part type="conn" code="m1">
      <name>Winch Motor with Magnet Switch Assembly</name>
    </part>
    <part type="conn" code="I86">
      <name>Windshield Wiper Motor Assembly</name>
    </part>
  </ttl>
</EWDSearch>