<?xml version="1.0" encoding="utf-8"?>
<!DOCTYPE EWDSearch SYSTEM "../../dtd/ewdsearch.dtd">
<EWDSearch ver="2.1.2.9" pubno="EM25T2E" xml:lang="en">
  <ttl id="WR007">
    <part type="conn" code="A10">
      <name>Antenna with Holder Assembly</name>
    </part>
    <part type="conn" code="A36">
      <name>Battery (Main)</name>
    </part>
    <part type="conn" code="A35">
      <name>Battery (Main)</name>
    </part>
    <part type="conn" code="A42">
      <name>Brake Actuator Assembly</name>
    </part>
    <part type="conn" code="A15">
      <name>Brake Fluid Level Warning Switch (Brake Master Cylinder Reservoir Sub-Assembly)</name>
    </part>
    <part type="conn" code="A25">
      <name>Brake Vacuum Check Valve Assembly</name>
    </part>
    <part type="conn" code="A27">
      <name>Brake Vacuum Check Valve Assembly</name>
    </part>
    <part type="conn" code="A28">
      <name>Brake Vacuum Check Valve Assembly</name>
    </part>
    <part type="conn" code="A26">
      <name>Brake Vacuum Check Valve Assembly</name>
    </part>
    <part type="conn" code="A13">
      <name>Front Airbag Sensor LH</name>
    </part>
    <part type="conn" code="B2">
      <name>Front Differential Lock Position Switch</name>
    </part>
    <part type="conn" code="A21">
      <name>Front Speed Sensor LH (Skid Control Sensor Wire LH)</name>
    </part>
    <part type="conn" code="B3">
      <name>Front Speed Sensor RH (Skid Control Sensor Wire RH)</name>
    </part>
    <part type="conn" code="A8">
      <name>Fuel Filter Vacuum Sensor</name>
    </part>
    <part type="conn" code="A9">
      <name>Fuel Sediment Switch</name>
    </part>
    <part type="conn" code="A38">
      <name>Headlight Assembly LH</name>
    </part>
    <part type="conn" code="A1">
      <name>Headlight Assembly LH</name>
    </part>
    <part type="conn" code="A3">
      <name>Headlight Assembly LH</name>
    </part>
    <part type="conn" code="A14">
      <name>Headlight Assembly LH</name>
    </part>
    <part type="conn" code="A5">
      <name>High Pitched Horn Assembly</name>
    </part>
    <part type="conn" code="A4">
      <name>Low Pitched Horn Assembly</name>
    </part>
    <part type="conn" code="A22">
      <name>No. 1 Junction Connector</name>
    </part>
    <part type="conn" code="B1">
      <name>No. 2 Differential Lock Shift Actuator</name>
    </part>
    <part type="conn" code="A23">
      <name>No. 2 Junction Connector</name>
    </part>
    <part type="conn" code="A43">
      <name>No. 34 Junction Connector</name>
    </part>
    <part type="conn" code="A11">
      <name>Side Turn Signal Light Assembly LH</name>
    </part>
    <part type="conn" code="A2">
      <name>Windshield Washer Motor and Pump Assembly</name>
    </part>
  </ttl>
</EWDSearch>