<?xml version="1.0" encoding="utf-8"?>
<!DOCTYPE EWDSearch SYSTEM "../../dtd/ewdsearch.dtd">
<EWDSearch ver="2.1.2.9" pubno="EM25T2E" xml:lang="en">
  <ttl id="WR029">
    <part type="conn" code="C114">
      <name>Air Fuel Ratio Sensor (Bank 1 Sensor 1)</name>
    </part>
    <part type="conn" code="C128">
      <name>Differential Pressure Sensor</name>
    </part>
    <part type="conn" code="C120">
      <name>DPF Temperature Sensor (No. 3 Exhaust Gas Temperature Sensor)</name>
    </part>
    <part type="conn" code="C112">
      <name>Injector Assembly No. 8</name>
    </part>
    <part type="conn" code="C123">
      <name>Injector Driver (EDU) (No. 1)</name>
    </part>
    <part type="conn" code="C122">
      <name>Injector Driver (EDU) (No. 1)</name>
    </part>
    <part type="conn" code="C124">
      <name>Injector Driver (EDU) (No. 1)</name>
    </part>
    <part type="conn" code="C121">
      <name>Injector Driver (EDU) (No. 1)</name>
    </part>
    <part type="conn" code="C125">
      <name>Injector Driver (EDU) (No. 2)</name>
    </part>
    <part type="conn" code="C126">
      <name>Injector Driver (EDU) (No. 2)</name>
    </part>
    <part type="conn" code="C127">
      <name>Injector Driver (EDU) (No. 2)</name>
    </part>
    <part type="conn" code="C118">
      <name>No. 1 Exhaust Gas Temperature Sensor</name>
    </part>
    <part type="conn" code="C111">
      <name>No. 1 Vacuum Switching Valve Assembly (for EGR Cooler Bypass Valve)</name>
    </part>
    <part type="conn" code="C119">
      <name>No. 2 Exhaust Gas Temperature Sensor</name>
    </part>
  </ttl>
</EWDSearch>