<?xml version="1.0" encoding="utf-8"?>
<!DOCTYPE EWDSearch SYSTEM "../../dtd/ewdsearch.dtd">
<EWDSearch ver="2.1.2.9" pubno="EM25T2E" xml:lang="en">
  <ttl id="WR042">
    <part type="conn" code="T11">
      <name>Back Buzzer Assembly</name>
    </part>
    <part type="conn" code="S25">
      <name>Curtain Shield Airbag Assembly LH</name>
    </part>
    <part type="conn" code="S22">
      <name>Curtain Shield Airbag Assembly RH</name>
    </part>
    <part type="conn" code="V2">
      <name>Differential Lock Shift Actuator</name>
    </part>
    <part type="conn" code="S26">
      <name>Door Side Airbag Sensor LH</name>
    </part>
    <part type="conn" code="S23">
      <name>Door Side Airbag Sensor RH</name>
    </part>
    <part type="conn" code="S6">
      <name>Front Door Courtesy Light Switch Assembly LH</name>
    </part>
    <part type="conn" code="S29">
      <name>Front Door Courtesy Light Switch Assembly LH</name>
    </part>
    <part type="conn" code="S4">
      <name>Front Door Courtesy Light Switch Assembly RH</name>
    </part>
    <part type="conn" code="S20">
      <name>Front Door Courtesy Light Switch Assembly RH</name>
    </part>
    <part type="conn" code="S28">
      <name>Front Seat Inner Belt Assembly LH</name>
    </part>
    <part type="conn" code="S19">
      <name>Front Seat Inner Belt Assembly RH</name>
    </part>
    <part type="conn" code="S12">
      <name>Front Seat Inner Belt Assembly RH</name>
    </part>
    <part type="conn" code="S27">
      <name>Front Seat Outer Belt Assembly LH</name>
    </part>
    <part type="conn" code="S18">
      <name>Front Seat Outer Belt Assembly RH</name>
    </part>
    <part type="conn" code="T3">
      <name>Fuel Pump</name>
    </part>
    <part type="conn" code="X2">
      <name>Fuel Pump (Sub)</name>
    </part>
    <part type="conn" code="T4">
      <name>Fuel Sender Gage Assembly (Rear)</name>
    </part>
    <part type="conn" code="X1">
      <name>Fuel Sender Gage Assembly (Rear)</name>
    </part>
    <part type="conn" code="T19">
      <name>Fuel Sender Gage Assembly (Rear)</name>
    </part>
    <part type="conn" code="W2">
      <name>Fuel Tank Solenoid Main Valve Assembly</name>
    </part>
    <part type="conn" code="W1">
      <name>Fuel Tank Solenoid Return Valve Assembly</name>
    </part>
    <part type="conn" code="T15">
      <name>License Plate Light Assembly LH</name>
    </part>
    <part type="conn" code="T16">
      <name>License Plate Light Assembly LH</name>
    </part>
    <part type="conn" code="T13">
      <name>License Plate Light Assembly RH</name>
    </part>
    <part type="conn" code="T12">
      <name>License Plate Light Assembly RH</name>
    </part>
    <part type="conn" code="S8">
      <name>No. 3 Room Light Assembly</name>
    </part>
    <part type="conn" code="S7">
      <name>No. 3 Room Light Assembly</name>
    </part>
    <part type="conn" code="S3">
      <name>Parking Brake Switch Assembly</name>
    </part>
    <part type="conn" code="S15">
      <name>Parking Brake Switch Assembly</name>
    </part>
    <part type="conn" code="T17">
      <name>Rear Combination Light Assembly LH</name>
    </part>
    <part type="conn" code="T14">
      <name>Rear Combination Light Assembly RH</name>
    </part>
    <part type="conn" code="V1">
      <name>Rear Differential Lock Position Switch</name>
    </part>
    <part type="conn" code="T18">
      <name>Rear Fog Light Socket &amp; Wire</name>
    </part>
    <part type="conn" code="V3">
      <name>Rear Speed Sensor (Skid Control Sensor Wire)</name>
    </part>
    <part type="conn" code="T10">
      <name>Trailer Socket</name>
    </part>
  </ttl>
</EWDSearch>